{
  "formatVersion": "0.4",
  "units": {
    "distance": "meter",
    "time": "second"
  },
  "laneGraph": {
    "edges": [
      {
        "id": "entry",
        "length": 12.0,
        "connections": [{ "toEdgeId": "exit" }]
      },
      {
        "id": "exit",
        "length": 8.0,
        "connections": []
      },
      {
        "id": "loop",
        "length": 5.0,
        "connections": [{ "toEdgeId": "loop" }]
      },
      {
        "id": "isolated",
        "length": 3.0,
        "connections": []
      }
    ]
  },
  "routes": [
    {
      "id": "main-route",
      "edgeIds": ["entry", "exit"]
    },
    {
      "id": "loop-once",
      "edgeIds": ["loop", "loop"]
    }
  ],
  "vehicleProfiles": [
    {
      "id": "passenger-car",
      "length": 4.5,
      "model": "iidm",
      "desiredSpeed": 13.9,
      "minGap": 2.0,
      "timeHeadway": 1.5,
      "maxAcceleration": 1.5,
      "comfortableDeceleration": 2.0,
      "emergencyDeceleration": 6.0
    }
  ],
  "signals": {
    "stopLines": [],
    "movementGates": [],
    "groups": [],
    "controllers": []
  }
}
